{"act":"1","analysis_version":"sts2.map-analysis-v1","approximation":"exact","assumptions":["route scores use public topology only"],"candidate_routes":[{"assumptions":["candidate is a structural route, not a reward estimate"],"first_action_id":"select-map-node:42:map:1:1:0","nodes":["map:1:0:0","map:1:1:0","map:1:2:0"],"score":{"category_score":0,"distance_to_terminal":2,"elite_count":0,"elite_exposure_before_rest":0,"rest_count":0,"retained_branching":1,"route_length":3,"shop_count":0},"selection":"exact","tie_break_key":"map:1:0:0\u001fmap:1:1:0\u001fmap:1:2:0"},{"assumptions":["candidate is a structural route, not a reward estimate"],"first_action_id":"select-map-node:42:map:1:1:1","nodes":["map:1:0:0","map:1:1:1","map:1:2:0"],"score":{"category_score":0,"distance_to_terminal":2,"elite_count":0,"elite_exposure_before_rest":0,"rest_count":0,"retained_branching":1,"route_length":3,"shop_count":0},"selection":"exact","tie_break_key":"map:1:0:0\u001fmap:1:1:1\u001fmap:1:2:0"}],"completeness":"complete","content_digest":"1529165eee80eb3eec6265a184c9109fee63ad58fbb464fcfc83248313aa1e6b","evaluator_version":"structural-v1","generation":42,"legal_destination_counts":[{"action_id":"select-map-node:42:map:1:1:0","count_decimal":"1","destination_node_id":"map:1:1:0","status":"exact"},{"action_id":"select-map-node:42:map:1:1:1","count_decimal":"1","destination_node_id":"map:1:1:1","status":"exact"}],"map_instance":"map-instance-1","node_metrics":[{"ancestors":[],"category_distances":{"boss":2,"event":1,"monster":1,"start":0},"descendants":["map:1:1:0","map:1:1:1","map:1:2:0"],"distance_from_current":0,"distance_to_terminal":2,"node_id":"map:1:0:0","reachable":true},{"ancestors":["map:1:0:0"],"category_distances":{"boss":1,"monster":0},"descendants":["map:1:2:0"],"distance_from_current":1,"distance_to_terminal":1,"node_id":"map:1:1:0","reachable":true},{"ancestors":["map:1:0:0"],"category_distances":{"boss":1,"event":0},"descendants":["map:1:2:0"],"distance_from_current":1,"distance_to_terminal":1,"node_id":"map:1:1:1","reachable":true},{"ancestors":["map:1:0:0","map:1:1:0","map:1:1:1"],"category_distances":{"boss":0},"descendants":[],"distance_from_current":2,"distance_to_terminal":0,"node_id":"map:1:2:0","reachable":true}],"snapshot_digest":"bbb959f20a5293032072ee9ab30c9489807ad185cec7d740f15dd929a9bfa622","source_state_id":"map-state-42","terminal_counts":[{"count_decimal":"2","status":"exact","terminal_id":"map:1:2:0"}],"topology":{"branch_nodes":["map:1:0:0"],"current_node":"map:1:0:0","cyclic":false,"edge_count":4,"merge_nodes":["map:1:2:0"],"node_count":4,"reachable_nodes":4},"warnings":[]}